{
  "event_id": "urn:uuid:5ea9f85a-869f-4aee-a025-8bf558e28d73",
  "schema_version": "0.1",
  "participant": { "id": "urn:example:synthetic-learner-01", "role": "learner" },
  "occurred_at": "2026-09-05T15:00:00Z",
  "recorded_at": "2026-09-05T16:10:00Z",
  "context": { "environment": "TYME Hall pilot", "mode": "self-directed inquiry", "visibility": "private", "synthetic_fixture": true },
  "action": { "verb": "investigated", "object": "relative humidity and atmospheric water yield" },
  "evidence": [{ "type": "simulation_result", "digest": "sha256:0123456789abcdef0123456789abcdef0123456789abcdef0123456789abcdef", "location": "urn:example:synthetic-evidence:001" }],
  "provenance": { "recorder": "urn:example:synthetic-learner-01", "source_system": "tyme-hall-synthetic-fixture", "transformations": [] },
  "consent": { "capture": "participant", "retention": "until-revoked", "default_disclosure": "private", "secondary_use": "prohibited" },
  "integrity": { "digest_algorithm": "sha-256", "canonicalization": "jcs-rfc8785", "digest": "sha256:aaaaaaaaaaaaaaaaaaaaaaaaaaaaaaaaaaaaaaaaaaaaaaaaaaaaaaaaaaaaaaaa", "signature_type": "data-integrity-proof", "proof": "detached-proof-placeholder" }
}
